{
  "schemaVersion": "1.0.0",
  "candidateId": "evidence-thread",
  "captures": [
    {
      "browser": "chromium",
      "stateRef": "marketing-desktop-light",
      "url": "http://127.0.0.1:4173/?candidate=evidence-thread",
      "viewport": {
        "width": 1440,
        "height": 1000
      },
      "screenshot": "/Users/vincenthopf/.treehouse/furtheringdesign-5d06ab/1/furtheringdesign/artifacts/ai-health/evidence-thread/chromium/marketing-desktop-light/page.png",
      "nodeMap": "/Users/vincenthopf/.treehouse/furtheringdesign-5d06ab/1/furtheringdesign/artifacts/ai-health/evidence-thread/chromium/marketing-desktop-light/evidence.json"
    },
    {
      "browser": "chromium",
      "stateRef": "marketing-mobile-light",
      "url": "http://127.0.0.1:4173/?candidate=evidence-thread",
      "viewport": {
        "width": 390,
        "height": 844
      },
      "screenshot": "/Users/vincenthopf/.treehouse/furtheringdesign-5d06ab/1/furtheringdesign/artifacts/ai-health/evidence-thread/chromium/marketing-mobile-light/page.png",
      "nodeMap": "/Users/vincenthopf/.treehouse/furtheringdesign-5d06ab/1/furtheringdesign/artifacts/ai-health/evidence-thread/chromium/marketing-mobile-light/evidence.json"
    },
    {
      "browser": "chromium",
      "stateRef": "dashboard-desktop-light",
      "url": "http://127.0.0.1:4173/app?candidate=evidence-thread",
      "viewport": {
        "width": 1440,
        "height": 1000
      },
      "screenshot": "/Users/vincenthopf/.treehouse/furtheringdesign-5d06ab/1/furtheringdesign/artifacts/ai-health/evidence-thread/chromium/dashboard-desktop-light/page.png",
      "nodeMap": "/Users/vincenthopf/.treehouse/furtheringdesign-5d06ab/1/furtheringdesign/artifacts/ai-health/evidence-thread/chromium/dashboard-desktop-light/evidence.json"
    },
    {
      "browser": "chromium",
      "stateRef": "dashboard-mobile-light",
      "url": "http://127.0.0.1:4173/app?candidate=evidence-thread",
      "viewport": {
        "width": 390,
        "height": 844
      },
      "screenshot": "/Users/vincenthopf/.treehouse/furtheringdesign-5d06ab/1/furtheringdesign/artifacts/ai-health/evidence-thread/chromium/dashboard-mobile-light/page.png",
      "nodeMap": "/Users/vincenthopf/.treehouse/furtheringdesign-5d06ab/1/furtheringdesign/artifacts/ai-health/evidence-thread/chromium/dashboard-mobile-light/evidence.json"
    },
    {
      "browser": "chromium",
      "stateRef": "dashboard-desktop-dark-reduced",
      "url": "http://127.0.0.1:4173/app?candidate=evidence-thread",
      "viewport": {
        "width": 1440,
        "height": 1000
      },
      "screenshot": "/Users/vincenthopf/.treehouse/furtheringdesign-5d06ab/1/furtheringdesign/artifacts/ai-health/evidence-thread/chromium/dashboard-desktop-dark-reduced/page.png",
      "nodeMap": "/Users/vincenthopf/.treehouse/furtheringdesign-5d06ab/1/furtheringdesign/artifacts/ai-health/evidence-thread/chromium/dashboard-desktop-dark-reduced/evidence.json"
    },
    {
      "browser": "firefox",
      "stateRef": "marketing-desktop-light",
      "url": "http://127.0.0.1:4173/?candidate=evidence-thread",
      "viewport": {
        "width": 1440,
        "height": 1000
      },
      "screenshot": "/Users/vincenthopf/.treehouse/furtheringdesign-5d06ab/1/furtheringdesign/artifacts/ai-health/evidence-thread/firefox/marketing-desktop-light/page.png",
      "nodeMap": "/Users/vincenthopf/.treehouse/furtheringdesign-5d06ab/1/furtheringdesign/artifacts/ai-health/evidence-thread/firefox/marketing-desktop-light/evidence.json"
    },
    {
      "browser": "firefox",
      "stateRef": "marketing-mobile-light",
      "url": "http://127.0.0.1:4173/?candidate=evidence-thread",
      "viewport": {
        "width": 390,
        "height": 844
      },
      "screenshot": "/Users/vincenthopf/.treehouse/furtheringdesign-5d06ab/1/furtheringdesign/artifacts/ai-health/evidence-thread/firefox/marketing-mobile-light/page.png",
      "nodeMap": "/Users/vincenthopf/.treehouse/furtheringdesign-5d06ab/1/furtheringdesign/artifacts/ai-health/evidence-thread/firefox/marketing-mobile-light/evidence.json"
    },
    {
      "browser": "firefox",
      "stateRef": "dashboard-desktop-light",
      "url": "http://127.0.0.1:4173/app?candidate=evidence-thread",
      "viewport": {
        "width": 1440,
        "height": 1000
      },
      "screenshot": "/Users/vincenthopf/.treehouse/furtheringdesign-5d06ab/1/furtheringdesign/artifacts/ai-health/evidence-thread/firefox/dashboard-desktop-light/page.png",
      "nodeMap": "/Users/vincenthopf/.treehouse/furtheringdesign-5d06ab/1/furtheringdesign/artifacts/ai-health/evidence-thread/firefox/dashboard-desktop-light/evidence.json"
    },
    {
      "browser": "firefox",
      "stateRef": "dashboard-mobile-light",
      "url": "http://127.0.0.1:4173/app?candidate=evidence-thread",
      "viewport": {
        "width": 390,
        "height": 844
      },
      "screenshot": "/Users/vincenthopf/.treehouse/furtheringdesign-5d06ab/1/furtheringdesign/artifacts/ai-health/evidence-thread/firefox/dashboard-mobile-light/page.png",
      "nodeMap": "/Users/vincenthopf/.treehouse/furtheringdesign-5d06ab/1/furtheringdesign/artifacts/ai-health/evidence-thread/firefox/dashboard-mobile-light/evidence.json"
    },
    {
      "browser": "firefox",
      "stateRef": "dashboard-desktop-dark-reduced",
      "url": "http://127.0.0.1:4173/app?candidate=evidence-thread",
      "viewport": {
        "width": 1440,
        "height": 1000
      },
      "screenshot": "/Users/vincenthopf/.treehouse/furtheringdesign-5d06ab/1/furtheringdesign/artifacts/ai-health/evidence-thread/firefox/dashboard-desktop-dark-reduced/page.png",
      "nodeMap": "/Users/vincenthopf/.treehouse/furtheringdesign-5d06ab/1/furtheringdesign/artifacts/ai-health/evidence-thread/firefox/dashboard-desktop-dark-reduced/evidence.json"
    },
    {
      "browser": "webkit",
      "stateRef": "marketing-desktop-light",
      "url": "http://127.0.0.1:4173/?candidate=evidence-thread",
      "viewport": {
        "width": 1440,
        "height": 1000
      },
      "screenshot": "/Users/vincenthopf/.treehouse/furtheringdesign-5d06ab/1/furtheringdesign/artifacts/ai-health/evidence-thread/webkit/marketing-desktop-light/page.png",
      "nodeMap": "/Users/vincenthopf/.treehouse/furtheringdesign-5d06ab/1/furtheringdesign/artifacts/ai-health/evidence-thread/webkit/marketing-desktop-light/evidence.json"
    },
    {
      "browser": "webkit",
      "stateRef": "marketing-mobile-light",
      "url": "http://127.0.0.1:4173/?candidate=evidence-thread",
      "viewport": {
        "width": 390,
        "height": 844
      },
      "screenshot": "/Users/vincenthopf/.treehouse/furtheringdesign-5d06ab/1/furtheringdesign/artifacts/ai-health/evidence-thread/webkit/marketing-mobile-light/page.png",
      "nodeMap": "/Users/vincenthopf/.treehouse/furtheringdesign-5d06ab/1/furtheringdesign/artifacts/ai-health/evidence-thread/webkit/marketing-mobile-light/evidence.json"
    },
    {
      "browser": "webkit",
      "stateRef": "dashboard-desktop-light",
      "url": "http://127.0.0.1:4173/app?candidate=evidence-thread",
      "viewport": {
        "width": 1440,
        "height": 1000
      },
      "screenshot": "/Users/vincenthopf/.treehouse/furtheringdesign-5d06ab/1/furtheringdesign/artifacts/ai-health/evidence-thread/webkit/dashboard-desktop-light/page.png",
      "nodeMap": "/Users/vincenthopf/.treehouse/furtheringdesign-5d06ab/1/furtheringdesign/artifacts/ai-health/evidence-thread/webkit/dashboard-desktop-light/evidence.json"
    },
    {
      "browser": "webkit",
      "stateRef": "dashboard-mobile-light",
      "url": "http://127.0.0.1:4173/app?candidate=evidence-thread",
      "viewport": {
        "width": 390,
        "height": 844
      },
      "screenshot": "/Users/vincenthopf/.treehouse/furtheringdesign-5d06ab/1/furtheringdesign/artifacts/ai-health/evidence-thread/webkit/dashboard-mobile-light/page.png",
      "nodeMap": "/Users/vincenthopf/.treehouse/furtheringdesign-5d06ab/1/furtheringdesign/artifacts/ai-health/evidence-thread/webkit/dashboard-mobile-light/evidence.json"
    },
    {
      "browser": "webkit",
      "stateRef": "dashboard-desktop-dark-reduced",
      "url": "http://127.0.0.1:4173/app?candidate=evidence-thread",
      "viewport": {
        "width": 1440,
        "height": 1000
      },
      "screenshot": "/Users/vincenthopf/.treehouse/furtheringdesign-5d06ab/1/furtheringdesign/artifacts/ai-health/evidence-thread/webkit/dashboard-desktop-dark-reduced/page.png",
      "nodeMap": "/Users/vincenthopf/.treehouse/furtheringdesign-5d06ab/1/furtheringdesign/artifacts/ai-health/evidence-thread/webkit/dashboard-desktop-dark-reduced/evidence.json"
    }
  ],
  "signals": [
    {
      "id": "evidence-thread-marketing-desktop-light-chromium-axe",
      "class": "A",
      "dimension": "accessibility",
      "source": "playwright-chromium",
      "status": "pass",
      "normalized": 1,
      "confidence": 0.98,
      "severity": "note",
      "stateRef": "marketing-desktop-light",
      "nodeRef": "document",
      "evidence": "No critical or serious axe violations.",
      "rationale": "Automated access failures break the hard contract.",
      "recommendation": "Complete manual assistive-technology review."
    },
    {
      "id": "evidence-thread-marketing-desktop-light-chromium-focus",
      "class": "A",
      "dimension": "accessibility",
      "source": "playwright-chromium",
      "status": "pass",
      "normalized": 0.95,
      "confidence": 0.9,
      "severity": "note",
      "stateRef": "marketing-desktop-light",
      "nodeRef": "button:Evidence ThreadThread",
      "evidence": "22 focus stops; 0 invisible.",
      "rationale": "The task needs a visible keyboard path.",
      "recommendation": "Run task-specific keyboard review."
    },
    {
      "id": "evidence-thread-marketing-desktop-light-chromium-overflow",
      "class": "B",
      "dimension": "responsiveResilience",